{
  "schema_version": "database.schema.v15",
  "playable_corpus_version": "playable_corpus.v1",
  "generated_at": "2026-04-09T13:18:45.666418+00:00",
  "run_id": "run:20260409T131842Z:4dbcf974",
  "items": [
    {
      "canonical_taxon_id": "taxon:birds:000013",
      "common_names_i18n": {
        "en": [],
        "fr": [],
        "nl": []
      },
      "confusion_hint": null,
      "confusion_relevance": "medium",
      "country_code": null,
      "diagnostic_feature_visibility": "high",
      "difficulty_level": "medium",
      "learning_suitability": "high",
      "location_bbox": null,
      "location_point": null,
      "location_radius_meters": null,
      "media_asset_id": "media:inaturalist:123587450",
      "media_role": "primary_id",
      "observed_at": "2021-04-28T00:00:00+00:00",
      "playable_item_id": "playable:qr:media:inaturalist:123587450",
      "qualified_resource_id": "qr:media:inaturalist:123587450",
      "scientific_name": "Troglodytes troglodytes",
      "similar_taxon_ids": [],
      "source_media_id": "123587450",
      "source_name": "inaturalist",
      "source_observation_id": "75531686",
      "what_to_look_at_general": [],
      "what_to_look_at_specific": [
        "head",
        "bill",
        "eye",
        "wing",
        "tail",
        "legs",
        "feet"
      ],
      "taxon_label": "Troglodytes troglodytes",
      "feedback_short": "head",
      "media_render_url": "https://static.inaturalist.org/photos/123587450/original.jpeg",
      "media_attribution": null,
      "media_license": null
    },
    {
      "canonical_taxon_id": "taxon:birds:000020",
      "common_names_i18n": {
        "en": [],
        "fr": [],
        "nl": []
      },
      "confusion_hint": null,
      "confusion_relevance": "high",
      "country_code": null,
      "diagnostic_feature_visibility": "high",
      "difficulty_level": "medium",
      "learning_suitability": "high",
      "location_bbox": null,
      "location_point": null,
      "location_radius_meters": null,
      "media_asset_id": "media:inaturalist:244861382",
      "media_role": "primary_id",
      "observed_at": "2022-09-20T00:00:00+00:00",
      "playable_item_id": "playable:qr:media:inaturalist:244861382",
      "qualified_resource_id": "qr:media:inaturalist:244861382",
      "scientific_name": "Phoenicurus ochruros",
      "similar_taxon_ids": [],
      "source_media_id": "244861382",
      "source_name": "inaturalist",
      "source_observation_id": "142786417",
      "what_to_look_at_general": [],
      "what_to_look_at_specific": [
        "head",
        "eye",
        "bill",
        "breast",
        "wing",
        "tail",
        "legs"
      ],
      "taxon_label": "Phoenicurus ochruros",
      "feedback_short": "head",
      "media_render_url": "https://static.inaturalist.org/photos/244861382/original.jpeg",
      "media_attribution": null,
      "media_license": null
    },
    {
      "canonical_taxon_id": "taxon:birds:000015",
      "common_names_i18n": {
        "en": [],
        "fr": [],
        "nl": []
      },
      "confusion_hint": null,
      "confusion_relevance": "high",
      "country_code": null,
      "diagnostic_feature_visibility": "high",
      "difficulty_level": "medium",
      "learning_suitability": "high",
      "location_bbox": null,
      "location_point": null,
      "location_radius_meters": null,
      "media_asset_id": "media:inaturalist:263030195",
      "media_role": "primary_id",
      "observed_at": "2023-03-26T00:00:00+00:00",
      "playable_item_id": "playable:qr:media:inaturalist:263030195",
      "qualified_resource_id": "qr:media:inaturalist:263030195",
      "scientific_name": "Turdus philomelos",
      "similar_taxon_ids": [],
      "source_media_id": "263030195",
      "source_name": "inaturalist",
      "source_observation_id": "152371528",
      "what_to_look_at_general": [],
      "what_to_look_at_specific": [
        "head",
        "eye",
        "beak",
        "breast",
        "wing",
        "tail",
        "legs"
      ],
      "taxon_label": "Turdus philomelos",
      "feedback_short": "head",
      "media_render_url": "https://static.inaturalist.org/photos/263030195/original.jpeg",
      "media_attribution": null,
      "media_license": null
    },
    {
      "canonical_taxon_id": "taxon:birds:000008",
      "common_names_i18n": {
        "en": [],
        "fr": [],
        "nl": []
      },
      "confusion_hint": null,
      "confusion_relevance": "medium",
      "country_code": null,
      "diagnostic_feature_visibility": "medium",
      "difficulty_level": "medium",
      "learning_suitability": "high",
      "location_bbox": null,
      "location_point": null,
      "location_radius_meters": null,
      "media_asset_id": "media:inaturalist:377623743",
      "media_role": "context",
      "observed_at": "2022-06-19T00:00:00+00:00",
      "playable_item_id": "playable:qr:media:inaturalist:377623743",
      "qualified_resource_id": "qr:media:inaturalist:377623743",
      "scientific_name": "Parus major",
      "similar_taxon_ids": [],
      "source_media_id": "377623743",
      "source_name": "inaturalist",
      "source_observation_id": "213670096",
      "what_to_look_at_general": [],
      "what_to_look_at_specific": [
        "head",
        "beak",
        "wing",
        "wings",
        "breast",
        "tail"
      ],
      "taxon_label": "Parus major",
      "feedback_short": "head",
      "media_render_url": "https://static.inaturalist.org/photos/377623743/original.jpeg",
      "media_attribution": null,
      "media_license": null
    }
  ]
}
